code,country,city_name,guide_type,title,intro,review,area,interest,company
33611,Denmark,Copenhagen,가이드 투어,[알쓸신덴] 코펜하겐 휘게투어 No.1(평점*****),"""백문이불여일견(百聞而不如一見)""""아는만큼 보인다""덴마크 25년차 전문통역가이드와 함께 하는 고품격 인문학 투어!코펜하겐과 근교 투어 시리즈 (전용 차량, 차량비 별도)[알쓸신덴] 코펜하겐 휘게투어 No.1(평점*****)[알쓸신덴] 근교 휘게투어 I(크론보(햄릿)성, 루이지애나 현대미술관) [알쓸신덴] 근교 휘게투어 II(로스킬드 대성당, 바이킹 선박박물관) [알쓸신덴] 코펜하겐&근교 당일치기 휘게투어 I(N투어)[알쓸신덴] 코펜하겐&근교 당일치기 휘게투어 II(W투어)[알쓸신덴] 투어 상품 시리즈에 언급된 '휘게,Hygge'는 오늘날 덴마크를 세계에서 가장 행복한 나라 그리고 덴마크 국민들이 세계에서 가장 행복한 국민들임을 대변해 주는 단어입니다. [알쓸신덴] 휘게투어에는  전용 차량을 이용하기에 편안하고 여유가 있으며,   바이킹시대부터 현재에 이르는 방대한 역사와 전문적인 지식이 있으며,  인터넷에서는 검색해도 나오지 않는 숨은 뒷이야기와 위트가 있습니다.  ",차량이 있어 편하게 다녔습니다. 운전도 잘해주시고 재미있는 멘트와 중간중간 말씀하신걸 역질문 하기때문에 집중해서 잘 들을 수 밖에 없는 그런 멘트였어요. 너무 좋았고 다시 코펜하겐을 간다면 꼭 다시 뵙고 싶은 가이드입니다. 특히 북유럽 다 돌고 코펜하겐을 마지막에 가신다면 가히 차량으로 움직이시는 이 상품이 최고 아닐까 싶네요ㅎㅎ 정말 최고였어요!가이드님 정말 친절하시고 추운 날씨에도 차로 이동할 수 있어서 너무 편했습니다. 덴마크 사회와 문화에 대해서도 많은 이야기를 들을 수 있어서 좋았습니다!! 가이드님 감사합니다!! :)덴마크 여행 첫날 가이드 투어를 한 것이 신의 한 수!차분하고 자세한 설명이 참 좋았고 한 곳이라도 더 보여주시려고 노력해주셔서 너무 감사했습니다. ,자연,Kn,허니문
56472,Sweden,Stockholm,가이드 투어,[한글투어] 스톡홀름 반나절 인문학 워킹투어 (스웨덴),"스웨덴은 매년 노벨상 시상식이 행해지는 나라,   아바 음악과 맘마미아, 삐삐의 나라, 복지국가입니다.스웨덴 수도 수도 스톡홀름은 숲과 14개의 섬들로 만들어진 도시이며 북유럽의 베네치아라고 불립니다. 스칸디나비아 반도의 최대 도시 스톡홀름에오신 것을 환영합니다.(상품의 매력)노벨상 시상식장과 구시가와 신시가 명소를  중심으로 3시간 워킹투어를 하며 스웨덴의 문화를 느껴봅니다.(투어코스)중앙역 미팅세르겔 광장드로트닝 (왕비) 명동거리국회의사당왕궁대성당한림원과 노벨 박물관대광장철의 광장 등*** 스웨덴에 정착하여 10여년을 여행 가이드 및 통역자로 일하고 있는 교민 가이드로부터      현지인들의 삶과 문화를 들어봅니다.","관광지 소개도 그렇고 여러 설명도 친절하게 잘 해주셔서 잘 보고 왔습니다~ 감사합니다^^스웨덴의 역사적인 지식과 더불어 북유럽의 전반적인 관계 등을 알 수 있고 궁금한 사소한 부분까지 모두 알려주시고 너무 친절하심 가이드님 발 나온 사진 투척 저 사진의 장소에 가서 스톡홀름 전반적인 부분을 설명 받아서 스톡 처음 오자마자 투어 받는걸 추천합니다.우리는 스톡홀름에 도착하고 시간상 돌아갈때쯤 진행하게 됬는데, 여향 시작전에 브리핑처럼 듣고 여행계획을 세우는것도 좋을듯! 친절하고~ 비오는 와중에도~ 불편하지 않게 해주시려는 가이드님의 노력이 빛났음!! ",도시,Kn,허니문
14977,Sweden,Stockholm,티켓/교통패스,스톡홀름의 물길과 다리를 따라 2시간 보트 투어 티켓," 본 상품은 evoucher 상품으로 이메일로 받은 바우처를 출력해서 제시해주시면 됩니다. (여행 확인증이 아닌 영어로 된 바우처를 지참하셔야 합니다) [ 이 티켓의 매력 포인트! ] 물 위에서 바라보는 아름다운 스톡홀름의 전경을 즐겨보세요! 다리 아래로 지나가는 크루즈에서 도심 지역을 바라보세요! 10가지 언어로 지원되는 녹음 가이드를 제공 받으세요!이 티켓을 이용해 2시간 동안 물 위에서 바라보는 스톡홀름을 경험해보세요! 관광 유람선에 올라 10개국 언어를 지원하는 녹음 가이드를 들으며 이 멋진 도시의 상징적인 명소들을 둘러볼 수 있습니다.이 투어에서는 스톡홀름의 여러 다리 밑을 거쳐가며 발트해와 말라렌(Mälaren) 호수를 연결하는 수문을 지나갑니다.동시에 크루즈를 타고 이동하며 이동하며 올드 타운(Old Town), 쇠데르말름(Södermalm) 섬, 릴라 에싱얀(Lilla Essingen)와 스토라 에싱얀(Stora Essingen), 하마비 허스타드(Hammarby Sjöstad)라는 새로운 지역, 그리고 왕실의 유르고덴(Djurgården) 내 초지까지 스톡홀름 도심의 주요 명소들도 살펴볼 수 있습니다.어른은 물론 가족에게도 안성맞춤인 이 투어야말로 완벽한 스톡홀름 관광을 완성시켜줄 것입니다!  티켓 예약 방법  구매하기를 눌러, 이용일자와 이용인원을 선택해주세요.  예약시 아래 시간 중, 원하시는 시간대를 선택하시어 남겨주시기 바랍니다. 투어 시간: 11시  13시  15시 중 택1 남겨주신 일자와 시간에 예약 가능 여부를 확인 후에 예약 진행 혹은 불가시 대체 가능한 시간을 안내드립니다,  별도로 보내드린 이바우처에 기재된 시간이 확정된 미팅시간이오니 꼭 바우처를 기준으로 시간 확인을 부탁드립니다. 여행확인증은 이바우처가 아닙니다. 이메일로 보내드린 이바우처를 확인후에 꼭 지참해주세요.",한국어 지원이 안되는것이 조금 아쉽지만 정말 필요한 포인트들을 한눈에 볼 수 있어서ㅎ 좋음!it was quiet cozy trip taking time on he boat. ,자연,Ex,혼자
36900,Iceland,Reykjavik,가이드 투어,레이캬비크 출발 : 북극광(오로라) 야간투어," 본 투어는 영어로 진행되며, 다국적 여행자들과 함께하는 단체 투어로 진행됩니다. 여행 확인증이 아닌, 영어로 된 바우처를 지참하셔야 합니다. [ 이 투어의 매력 포인트! ] 시즌 상품입니다. 첫 여행자에게 완벽합니다. 아는 것이 많고 친절한 전문 가이드가 동행합니다. 무료 호텔 픽업샌딩 서비스가 포함됩니다.[ 투어 코스 ]북극광(오로라)은 지구에서 볼 수 있는 가장 독특한 광경 중 하나입니다. 저희가 모든 여행자에게 북극광을 목격하는 잊을 수 없는 경험을 선사하기 위해 노력하는 이유입니다. 투어는 매일 진행되며, 전문 가이드가 안내합니다.저희는 다년간의 경험을 토대로 북극광을 가장 잘 볼 수 있는 최적의 조건에 대한 노하우를 지니고 있습니다. 매 투어 전 기상예보를 확인하고, 그날 밤 최적의 장소가 어디일지 검토합니다.조건이 맞는다면 북극광이 하늘을 가로지르며 춤추는 광경을 목격할 수 있습니다. 밤하늘을 그림 그리듯 수놓는 모양과 색을 놓치지 마세요. 예약 방법  캘린더에서 이용 일자와 인원을 선택한 후, 원하는 시간대를 선택해 주세요.  별도로 보내드린 e바우처에 기재된 만나는 시간 및 장소를 반드시 재확인하시기 바랍니다.",아이슬란드 도착한 날 예약해 뒀었는데 날씨가 안좋아 두번이나 취소되고 세번째만에 갔는데 그날도 못봤어요.2년안에 볼 수있을때까지 다시 신청하면 된다는데 갈 일은 없을 거 같고...좋은 경험이었습니다. 가보진않았으나 여행완료라 뜬게 어이없어서 적는후기.1.출발몇시간전 취소메일 재예약방법보냄2.재예약이안되 바우처에적힌 곳으로 문의하니 이쪽으로하라고함3.이쪽은 연락이안되서 결국 환불이아닌 이틀후로 재예약함4.갑자기 이쪽에서 취소했다며 바우처를줄수없다함5.3~4곳에서 서로 다른곳에연락하라며 해결해주지않음6.돈만뺏김너무 무성의한 진행이 아쉬웠어요,자연,Ad,혼자
26969,Iceland,Reykjavik,가이드 투어,레이캬비크 출발 : 골든 서클 클래식 버스 1일 투어," 본 투어는 영어로 진행되며, 다국적 여행자들과 함께하는 단체 투어로 진행됩니다. 여행 확인증이 아닌, 영어로 된 바우처를 지참하셔야 합니다. [ 이 투어의 매력 포인트! ] 스트로쿠르 간헐천에서 터져나오는 온천을 구경해보세요! 장엄하게 32m 아래로 떨어지는 굴포스 폭포를 감상해보세요! 바이킹의 역사에 대해 알아보고, 유네스코에 지정된 싱벨리어 국립공원에 방문해보세요![ 투어 코스 ]유네스코 세계 유산이자 현존하는 세계에서 가낭 오래된 의회의 본고장인 싱벨리어 국립공원 방문으로 투어가 시작됩니다. 이는 또한 미국과 유라시아 지각판이 따로 분리되어 아이슬란드에서 가장 큰 호숫가에서 열곡을 만들고 있습니다.원래 간헐천의 자생지이자 아이슬란드에서 가장 상징적인 자연 명소인 게이시르 온천을 방문해보세요. 이곳에서 지면의 흔들림과 뜨거운 물의 증기가 유명한 스트로쿠르 간헐천에서 하늘 위로 몇 분 간격으로 장관을 이루며 솟구쳐 오릅니다.장엄한 굴포스 폭포로 여유롭게 걸어 내려가보세요. 강력한 빙하 강은 좁은 협곡으로 천둥같은 포효와 함께 32 m 에서 두 단계로 폭포수가 되어 떨어집니다.와이파이와 각 좌석마다 연결된 컴퓨터 태블릿이 장착된 새로운 버스에 탑승하게 됩니다. 태블릿으로 아이슬란드와 투어로 방문할 장소에 대해 더 알아보기 위해 GPS인식 오디오 가이드 (여러 언어로 가능)를 사용할 수 있습니다.나라에 대해 가질 수 있는 질문에 기꺼이 대답할 주최자가 버스에 있을 것입니다. 각 좌석은 USB 충전기가 장착되어 있습니다. 예약 방법  캘린더에서 이용 일자와 인원을 선택한 후, 원하는 시간대를 선택해 주세요.   구매하기 단계에 픽업샌딩을 위한 호텔정보를 기재해 주세요.  예약 확정 후 '예약 내역' e티켓(바우처)에서 만나는 시간 및 장소를 반드시 재확인하시기 바랍니다.",좋아요~진짜 친절하고 좋았어용 한국인은 저희 밖에 없었는데도 진짜 잘해쥬셨어요진짜 최악중에 최악현지 겨울날씨 8시30분 픽업이라고 절때 늦지마라길래 10분정도 일찍나가 9시30분까지 1시간 넘게 기다림얼어죽을꺼같아서 마이리얼트립통해 연락하니 취소됐다고 메일못받았냐고함3시간전 투어 확정이니 제시간에 나오라는 메일만왔음사과도없고 배째라임 한국어 설명도  블로그 반도 안되는 수준. 개별로에요.그래도 하겠다면 하세요.12시 꺼로 다시 잡아줘서 11시30분 픽업이라고해서 또 11시 20분에 나가서 40분 기다리다가 12시에 타서 투어시작투어중 가이드는 괜찮았어요.친절하고 영어발음도 좋음,자연,Ex,친구
26964,Iceland,Reykjavik,가이드 투어,레이캬비크 요쿨살론(Jökulsárlón) 빙하 라군 종일 투어," 본 투어는 영어로 진행되며, 다국적 여행자들과 함께하는 단체 투어로 진행됩니다. 여행 확인증이 아닌, 영어로 된 바우처를 지참하셔야 합니다. [ 이 투어의 매력 포인트! ]  요쿨살론 빙하 라군의 빙산 셀랴란드스 폭포의 폭포수 뒤로 걷기 비크(Vik)에 위치한 아이슬란드 최남단 마을 방문 청명한 날 볼 수 있는 에이야프야틀라이외쿠틀(Eyjafjallajökull)[ 투어 코스 ]본 투어는 하루 동안 아이슬란드 남부의 드라마틱한 풍경을 탐험하고 유럽에서 가장 큰 빙하인 요쿨살론 빙하 라군을 방문합니다.레이캬비크의 숙소에서 픽업 후, 남쪽 해안과 드라마틱한 빙하 라군으로 향합니다. 목적지로 향하는 동안 수면 위에 떠있는 빙산과 그 절경을 감상할 수 있습니다. 요쿨살론 빙하 라군은 아이슬란드에서 가장 거대하고 깊은 빙하 라군입니다. 이는 유럽에서 가장 큰 빙하로 브레이다메르쿠르요쿨 (Breidamerkurjokull)에서 뻗어 나온 것으로, 바트나요쿨( Vatnajokull)의 분출 빙하입니다.레이캬비크로 돌아가며,  스코가 폭포와 셀랴란드스 폭포를 방문합니다. 셀랴란드스 폭포의 폭포수 뒤를 걸으며 스코가 폭포의 물이 얼굴에 튀기는 것을 느껴보세요! 검은 모래의 다이아몬드 비치를 방문하고 비크(Vik)에 위치한 아이슬란드의 최남단 마을에서 저녁 식사를 합니다.",요쿨에서 여유로운 시간도 주고 하루에 많은 곳을 보고 올 수 있어 좋습니다! 물론 버스 타는시간이 많아서 힘들지만 중간중간 가이드분이 설명도 해주시기에 괜찮은거 같아요!버스 이동시간이 길다는 불편함은 있지만자가용을 이용하지 않는 사람들은 이용하기 좋은 투어가이드분이 정말 성심껏 안내해주고 챙겨줍니다. 긴시간이라 무척 피로할 수 있는 여정이지만 이색적이고 보기드문 투어라 좋았어요.,자연,Ad,혼자
47351,Iceland,Reykjavik,가이드 투어,레이캬비크 : 케리드 분화구 포함 골든 서클 일일 투어," 본 투어는 영어로 진행되며, 다국적 여행자들과 함께하는 단체 투어로 진행됩니다.  여행 확인증이 아닌, 영어로 된 바우처를 지참하셔야 합니다. [ 이 투어의 매력 포인트! ] 호텔 픽업이 포함되어 있습니다.  모든 입장료가 포함되어 있습니다. [ 투어 코스 ]그랜드 골든 서클 투어에서 현지 가이드와 함께 남서 아이슬란드의 가장 인기 있는 명소에 방문해보세요. 레이캬비크 중앙의 지정된 장소에서 픽업한 뒤 투어를 시작합니다.  8분 간격으로 30m 높이의 물을 뿜어내는 게이시르와 스트로쿠르를 구경하고 굴포스 폭포에 방문해 32m 깊이의 틈 사이로 떨어지는 폭포수를 구경해보세요. 그다음 북아메리카와 유라시아 지각판이 매년 수 센티미터의 속도로 떨어져 나가는 싱벨리어 국립공원으로 향합니다. 2004년에 유네스코 세계 문화유산에 등재된 싱벨리어 국립공원에서 역사와 지질학적 경이로움을 느껴보세요. 너비 270m, 깊이 55m의 크기를 자랑하는 케리드 분화구 호수에 방문한 뒤 출발 지점으로 돌아가 투어를 마무리합니다.  예약 방법  캘린더에서 이용 일자와 인원을 선택한 후, 원하는 시간대를 선택해 주세요.   구매하기 단계에서 해당되는 호텔명을 선택해 주세요.         예약 확정 후 '예약 내역' e티켓(바우처)에서 만나는 시간 및 장소를 반드시 재확인하시기 바랍니다.","가이드분이 친절하고 유쾌햇어요너무 좋았고, 제시간에 출발했고, 날씨운만 받혀준다면 역대급 여행이 될 수 있어요!! 여러군데를 버스덕분에 편리하게 다 돌아볼 수 있어 좋았어요! 가이드 분께서 버스 안에서 마이크로 설명도 해주시고 관광지 내려서는 자유롭게 돌아다니는 방식이라 더 좋았어요! 피곤할땐 잠도 잘오고 버스가 매우 편했답니당 아이슬란드는 정말 다시 가고싶은 곳이네요!",자연,Ex,친구
26966,Iceland,Reykjavik,가이드 투어,레이캬비크에서 출발하는 아이슬란드 남부 1일 투어," 본 투어는 영어로 진행되며, 다국적 여행자들과 함께하는 단체 투어로 진행됩니다.  본 상품은 e바우처 상품으로 이메일로 받은 바우처의 출력본 혹은 모바일 제시해주시면 됩니다. [ 이 투어의 매력 포인트! ] 셀랴란드스 폭포(Seljalandsfoss) 남부 해안의 검은 모래 해변 아이슬란드의 최남단 마을 비크(Vik) 솔헤이마요쿨(Sólheimajökull)의 빙하 강, 폭포, 그리고 빙산의 독특한 풍경 경이로운 스코가포스(Skógafoss) 폭포[ 투어 코스 ]레이캬비크에서 출발하여 드라마틱한 아이슬란드 남부와 그 해안가를 탐험하는 하루 투어에 참여하세요! 레이캬비크 중심에 위치한 지정된 호텔 또는 게스트하우스에서 픽업 후, 경이로운 솔헤이마요쿨과 스코가포스 폭포를 향해 떠납니다.목적지로 향하며 다양한 강, 폭포, 산, 그리고 빙하 등을 볼 수 있습니다. 셀랴란드스 폭포에 도착하여 케스케이드 뒤를 걸으며 얼굴 위로 떨어지는 물줄기를 느껴보세요! 계속해서 스코가포스 폭포로 이동해 60미터 아래로 떨어지는 폭포수에 감탄하고 남부 해안의 검은 모래 해변을 즐깁니다. 더불어 솔헤이마요쿨의 빙하 지역을 방문해 밀달스죄쿨(Mýrdalsjökull)의 분출빙하를 보고 감탄하며 변화무쌍한 자연을 가까이에서 감상할 수 있습니다.레이캬비크로 돌아가기 전, 아이슬란드 최남단 마을이자 밀달스죄쿨(Mýrdalsjökull) 빙하 남쪽, 비크에 위치한 현무암 씨스택을 보며 투어는 막을 내립니다.",투어 버스안에서 여성 가이드님의 유쾌한 설명에 세계 각국에서 온 투어객들이 좀 더 즐거운 여행이 되는데 도움이 되었습니다.다만 아쉬운 점은 관광명소에 도착해서 풍경을 즐길 시간이 많지 않아서 시간에 쫒겨 제대로 둘러 볼 수 없었던 점이 아쉬웠습니다.투어할때 점심이나 간식 보온병에 따뜻한 차나 물 챙겨가시는 게 좋아요. 점심시간이 길지 않고 음식점에 사람들이 많아서 주문하고 대기하는 시간이 길어 자칫 먹지 못 할 경우가 발생할 수 있습니다. 저흰 전날 보너스 마트에서 샌드위치사서 따뜻한 차와 먹었습니다. 음식점 안에서는 먹을 수 없어요. 외부에서 가지고 온 음식을 음식점에서 먹지 못하게 해서...그 추운날 밖에서 먹었네요.당연히 외부 음식을 움식점에 반입하면 안되겠죠. 휴게실 같은곳을 만들어서 음료수 정도 주문하고 편하게 먹을 수 있는 곳이 있었으면 하는 생각이 들었습니다.새로운 경험이었습니다!가이드님도 친절하시고 좋았습니다!,자연,Ad,혼자
47344,Iceland,Reykjavik,가이드 투어,레이캬비크 출발 : 골든 서클 클래식 당일치기 투어," 본 투어는 영어로 진행되며, 다국적 여행자들과 함께하는 단체 투어로 진행됩니다.  여행 확인증이 아닌, 영어로 된 바우처를 지참하셔야 합니다. [ 이 투어의 매력 포인트! ] 버스를 타고 편안한 여행을 즐겨보세요.  현지 가이드의 안내를 받아보세요.  호텔 픽업 및 샌딩이 포함되어 있습니다. [ 투어 코스 ]투어는 그림처럼 아름다운 싱그발라바튼 호수의 지열 지역에서 시작됩니다(*겨울에는 포함되지 않을 수도 있습니다).그리고나서 싱벨리어 국립공원에 방문해보세요. 930년에 설립되어 세계에서 가장 오래된 의회라고 할 수 있는 알싱 유적이랍니다. 이곳은 미국과 유럽의 지각판이 만나는 곳이기도 해요.아이슬란드 방문의 하이라이트인 굴포스의 아름다운 폭포와 간헐천으로 알려진 게이시르, 스트로쿠르의 놀라운 풍경을 감상하고 아이슬란드 주교들의 고대 거처인 스칼홀트 교회를 방문해보세요. 레이캬비크로 돌아가는 길에 비옥한 농경 지역을 구경해보세요.  예약 방법  캘린더에서 이용 일자와 인원을 선택한 후, 원하는 시간대를 선택해 주세요.   구매하기 단계에 픽업샌딩을 위한 호텔정보를 기재해 주세요.    예약 확정 후 '예약 내역' e티켓(바우처)에서 만나는 시간 및 장소를 반드시 재확인하시기 바랍니다.","시간이 촉박하다고 느껴졌습니다. 그 외에는 다 좋았어요! 친절한 가이드의 설명과 안내에 편안하고 재밋는 투어였습니다.버스를 타고 이동해서 편하고 가이드가 버스에서 관련 설명을 해준다. 투어 특성 상 각 장소에서 시간이 넉넉하지 않은 것은 이해하나, 싱벨리어 국립공원에서 자유 시간을 너무 적게 주어서 아쉬웠다.편하게 투어하기 좋습니다 다만 여행지마다 시간이 촉박하다고 느낄 수 있습니다",자연,Ex,친구
65335,Finland,Helsinki,가이드 투어,"[투어] 헬싱키, 도보와 트램으로 산책하듯 투어하기 (핀란드/헬싱키)","헬싱키에서 반드시 봐야하는 장소들을 안내해드립니다.한국어로 북유럽 감성을 한껏 느낄 수 있는 도보여행헬싱키에 오시는 한국분들에게 헬싱키 곳곳의 예쁜 부분을 소개해드립니다!헬싱키에서 10년 전 관광객으로 왔을 때의 경험과 현지인으로써의 경험을 살려 헬싱키에서 반드시 가봐야할 곳들을 안내해드려요.관광객들에게 인기 있는 장소부터 제가 헬싱키에서 가장 좋아하는 장소들까지 함께 가보려고 해요! (핀란드는 날씨의 변화가 심해서 날씨에 따라 가볼만한 장소들이 변경되어요.)세나틴 광장과 에스플라나디 공원, 마켓 광장, 헬싱키 도서관은 반드시 가봐야겠죠?최대 9명으로 진행되는 소규모 투어로 헬싱키의 궁금증을 다 풀어드립니다도시에 대한 열정을 가진 친절한 현지인과 함께 헬싱키를 탐험하고 여행을 최대한 활용할 수있는 모든 힌트와 팁을 공유합니다.* 원하시는 일정으로 개인 맞춤 투어를 원하시는 분들은 메세지를 남겨주시면 투어 가능 여부와 경비 등 따로 자세한 투어 안내를 해드립니다.(미리 메시지를 보내주시면 추가금액이 포함된 견적서를 발송해드립니다.)","추운 날씨에도 불구하고 헬싱키 시내 명소를 돌아보며, 친절하게 설명해주셔서 감사했습니다. 궁금한 점에 대해서도 적극적으로 친절히 답변해주시고 배경 좋은 곳에서 사진도 많이 찍어주셔서 감사했습니다. 추웠지만 덕분에 즐거운 여행이 되었습니다. 다음에 여름에 꼭 다시 방문하고 싶습니다.전반적인 헬싱키의 모습을 느낄 수 있오 좋았어요. 짧은 시간안에 헬싱키의 명소를 설명과 함께 둘러보기 좋았던 것 같아요~ 가이드님의 경험이 더 쌓이시면 좀더 자연스럽고 깊이있는 진행이 될수 있을 것 같습니다:)가이드님 덕분에 헬싱키라는 도시뿐만 아니라 핀란드에 대해 많은 애정을 갖게 되었습니다! 그리고 투어 전후로도 유용한 여행 정보 많이 알려주셔서 투어뿐만 아니라 핀란드 여행 자체가 유익해졌어요 :) ",도시,Ex,가족
49425,Finland,Helsinki,가이드 투어,[투어] 헬싱키 시티 투어 :: 핀란드/헬싱키,"핀란드의 수도 헬싱키 관광지 투어 (소요 시간: 3시간 30분정도) 헬싱키 주요 관광지(원로원 광장, 헬싱키 대성당, 우스펜스키 러시아 정교 사원, 시벨리우스 공원, 마켓 광장)를 소개드립니다. 헬싱키 관광 및 쇼핑 팁 공유* 도보와 트램, 버스 등 대중 교통을 이용한 투어",헬싱키에서 꼭 이용해야하는 데이투어 상품이라고 생각합니다~ 덕분에 잘 보고 왔습니다^^친절한 이모와 함께 다니는 느낌으로 덕분에 좋운 여행 했습니다. 실제 사시는 분의 소소한 이야기를 들으며 이곳저곳을 다닐 수 있습니다. 가이드님덕분에 헬싱키가 더 좋아졌어요^^헬싱키의 근대와 현대사를 알게되고 국민성 문화등 해박한 지식덕분에 또오고픈 생각이 드네요 핫플도 알려주셔감사해요^^담에 오면 또 뵙고프네요 ㅎ,도시,Ex,허니문
