code,country,city_name,guide_type,title,intro,review,area,interest,company
34407,Romania,Bucharest,가이드 투어,"부쿠레슈티에서 출발하는 펠레슈성, 브란성, 브라쇼브 당일 투어"," 본 투어는 영어로 진행되며, 다국적 여행자들과 함께하는 단체 투어로 진행됩니다.  여행 확인증이 아닌, 영어로 된 바우처를 지참하셔야 합니다. [ 이 투어의 매력 포인트! ] 아름답고 역사가 깊은 펠레슈성 방문 브란성이 드라큘라 성으로 알려지게 된 계기 알아보기 오래된 마법 같은 도시 브라쇼브 탐방[ 투어 코스 ]픽업 후 시나이아로 떠나 루마니아의 왕들이 살던 펠레슈 성Peles Castle을 방문합니다. 15세기부터 19세기까지 오랜 기간 모아온 가구, 장식용품, 카펫, 태피스트리, 조각, 회화 및 무기 컬렉션을 감상하세요.투어는 브란 성Bran Castle으로 이어집니다. 일명 드라큘라 성으로도 알려진 곳입니다. 성의 역사와 트란실바니아Transylvania와 왈라키아Wallachia의 경계에 위치한 성으로서 취해야 했던 전략들에 대해서 알아보세요.브라쇼브Brasov에 가서는 르네상스, 바로크, 지역적인 신고전주의 양식으로 지어진 마을의 집들을 구경하세요.브라쇼브에는 유럽에서 가장 견고한 요새 중 하나인 중세시대의 요새가 있습니다. 지금까지 보존된 오래된 벽과 흑백의 탑, 직공의 요새를 탐방할 수 있습니다.요새가 간직하고 있는 또 다른 볼거리는 서쪽의 슈케이 게이트Schei Gate 근처에 있는 캐서린 게이트Catherine's Gate입니다. 게이트를 둘러싼 4개의 작은 탑은 봉신의 생사를 결정할 수 있는 중세시대 왕의 권리를 나타냅니다.투어는 부쿠레슈티에 돌아오면 종료되며, 샌딩 서비스가 제공됩니다. 예약 방법  캘린더에서 이용 일자와 인원을 선택해 주세요.  별도로 보내드린 e바우처에 기재된 만나는 시간 및 장소를 반드시 재확인하시기 바랍니다.",웃음을 잃지 않는 가이드의 친절한 설명과 긴 이동 시간에도 역사와 관련된 이야기를 해주는 등 우리에게 많은 신경과 노력을 기울인다. 무엇보다 숙소 바로 근처까지 태워주고 내려주는 서비스는 너무 편했다. The Guide was real professional and he did his best to introduce & to explain about historical backgrounds.,자연,Ex,혼자
42575,Romania,Bucharest,가이드 투어,[한글투어] 드라큘라성 & 펠레슈성 클림트 미술 투어 (1일)::루마니아/부쿠레슈티 출발,"(상품 매력 포인트)루마니아 최고 관광지 트랜슬베니아 지역 ""드라큘라 성 (브란성)""을 방문하는 것과 카르파티아 진주인 카를 황제 여름 별장"" 펠레슈 성""을 방문하는 것입니다. 펠레슈 성은 오스트리아 화가 구스타브 클림트가  방문하여 그림을 그렸던 곳으로 유명합니다. 클림ㅌ의 초기 작품들을 감상하는 것이 또한 여행의 묘미입니다. 울창한 숲과 나무 조각 인테리어와 클림트의 그림으로 장식된 펠레슈 여름별장의 예술성에 감탄이 저절로 나올 것입니다.오고 가면서 우리는 트란슬바니아 알프스산맥 리조트를 드라이빙하며, 루마니아 최고 휴양마을 시나이아 마을을 드라이빙 합니다.(투어코스)펠레슈 성까지 드라이빙 (1시간)시나이아 휴양지 마을 드라이빙 (10분)휴양지 펠리소르 성 주변 산책 ( 20분)펠레슈 성 내부 투어 (1시간)트랜슬베니아 알프스산맥 리죠트 드라이빙 (30분)브란성 주변 트렌실베니아 초원 드라이빙 (20분)드라큘라 브란성 내부 투어 (1시간)부카레스트로 이동 (2시간)","한국인 가이드를 찾다가 알게되어 에델바이스에 예약을 했어요. 한국인 가이드와 전용차량으로 이동했구요. 펠레슈성이 정말 환상적이더라구요. 루마니아에 가면 이 곳은 필수입니다. 카를왕의 나무별장이 시원하고 외관이나 인테리어나 예술 자체입니다. 그리고 그곳이휴양지 산이어서 여름에는 시원하고 겨울에는 눈이 있는 지역입니다. 그리고 드라큘라 성이리고 하는 브란성에 방문했어요. 신비운 케슬이었어요. 오고가면서 루마니아 시골 사람들과 달구지 끄는 농민들도 있었는데 볼거리였어요. 우리나라에는 달구지를 안끈지가 오래되었는데 쓰는 집시들이 있더라구요. 하여튼 루마니아에 가시면 하루는 이 투어를꼭 하는게좋겠다는 생각이 듭니다. 저희는 부카레스트는 반자절 워킹투어를 했어요. 가이드님도 선하고 친절하시고 루마니아에서 현지인과 결혼하여 살면서 루마니아 사람들들 잘 알고 있어서, 루마니아인에 대해서 잘 들을 수있어서 좋았어요. 고맙습니다.",자연,Ex,혼자
16495,Romania,Bucharest,가이드 투어,부쿠레슈티: 시장과 마할라 소규모 그룹으로 투어하기," 본 투어는 영어로 진행되며, 다국적 여행자들과 함께하는 단체 투어로 진행됩니다.  여행 확인증이 아닌, 영어로 된 바우처를 지참하셔야 합니다. [ 이 투어의 매력 포인트! ] 오래된 중심가에서부터 문화가 가득한 마할라까지 부쿠레슈티의 풍미를 느껴보세요! 최고의 치즈, 길거리 음식, 도넛 등 전통 루마니아 음식을 맛보세요! 부쿠레슈티에서 가장 크고 활기찬 시장을 거닐어보세요! 유명한 맥주 양조장에서 매일 만드는 시원한 맥주와 수제 브랜디도 맛보세요! 현지 거리를 따라 트램을 타고 도시를 누비세요! [ 투어 코스 ]정치적으로나 지리학적으로나 부쿠레슈티의 중심인 대학 광장(University Square)에서 출발하여 루마니아 혁명 이후 학생들과 광부들이 싸웠던 큰 거리도 볼 수 있습니다. '부쿠레슈티의 성 제르마노'로 알려지고 오래된 미국 대사관 지역인  Strada Batistei로 가기 전에 모든 정치·사회적인 이야기를 들을 수 있습니다. 이 지역은 19세기 신낭만주의 양식의 건축물들로 유명합니다.첫 번째 장소는 지금은 복원되었지만, 과거 부쿠레슈티의 부패의 대표적인 표상이었던 아름다운 도시 주택들이 가득한 곳입니다. 가로수 아래에 포도가 열려 있고, 염소젖 치즈와, 절인 고기, 봄양파, 수제 빵, 수제 생맥주를 포함한 루마니아식 앙트레(gustari)를 맛볼 수 있고, 이 멋진 곳의 분위기에 취할 수 있습니다. 루마니아인들이 도시의 복잡함과 문화를 좋아하는 반면, 그들이 즐겨먹는 음식은 소박한 음식(cucina povera)으로, 도시 주택에서 이러한 음식을 먹는 것은 현지 루마니아인들의 입맛과 생각을 제대로 알 수 있게 해줍니다.먹은 것을 소화시키기 위해서 아르메니아 지구(Armenian quarter)로 이동합니다. 아르메니아인들은 오스만 제국과의 중개무역으로 18~19세기에 성공한 상인 공동체를 이뤘습니다. 아르메니아 교회를 중심으로 이루어진 마할라 지역은 부유한 상인들이 그들의 취향대로 선택한 유럽과 오스만 제국에서 온 다양한 건축 양식을 볼 수 있습니다. 고전주의, 벨 에포크, 현대식, 신고전주의, 발칸 반도식, 절충한 형태 등 모든 건축 양식을 볼 수 있습니다.도시에서 가장 아름답고 조용한 유명한 만툴리사 거리(Mantuleasa)에 가기전, 오래된 유태인 거주 지구를 지나 길거리 음식 covrigi를 먹기 위해 잠시 멈춥니다. 19세기와 전쟁 기간의 부쿠레슈티를 경험한 후에는, 부쿠레슈티의 필수 교통수단인 트램을 타고 예술과 서점, 정원이 만나는 곳에서 시원한 루마니아 바이스비어를 마십니다. 유명한 Mosilor 거리를 지나면, 구획화된 블록과 집들이 있는 부쿠레슈티 사회주의 지구에 도착합니다. 오보르 시장(Obor Market)은 부쿠레슈티에서 가장 크고 유명한 재래 시장이며, 상상할 수 있는 것부터 없는 것까지 모든 종류의 음식, 물품, 서비스가 있습니다.루마니아의 음식, 향, 장소를 따라가다 보면은 루마니아 전통의 브랜디 'palinca'를 맛볼 수 있습니다. 소, 양, 염소가 만드는 다양한 루마니아 치즈도 맛볼 수 있습니다. 그 후에는, 채소 시장에서 다양한 색깔의 신선한 채소도 맛보고 사진찍을 수 있습니다.아마 가장 유명하고 대표적인 루마니아의 음식은 '작다'라는 뜻에 'mici'라는 음식일 것입니다. 껍질 벗긴 소세지에 머스타드와 시원한 맥주가 함께 나오는데, 모든 루마니아 사람들은 가장 최고의 맛을 가진 곳에 대한 생각이 똑같을 것입니다. 그러나, 확실히 오보르 시장의 가게가 50년이 넘는 세월에 걸친 mici 맛집으로 소문나 있지만, 그게 싫으시면 다른 곳으로 가셔도 됩니다! 마지막으로 먹방 투어는 디저트와 함께 종료됩니다. 집에 갈때까지 뜨거운 달콤한 왈라키아식 도넛도 드셔보세요!","한글이 아닌 영어로만 진행이 되니 영어 못하는 분들은 지양하시는게 좋습니다.가이드가 친절해서 영어 어느정도 하는 분들은 재미나게 투어 진행 하실 수 있습니다..계속 먹고 먹고 먹어서 배가 부릅니다..걷기도 많이 걸어서 힘들긴하네요.",도시,Fo,혼자
24616,Lithuania,Vilnius,가이드 투어,"빌니우스 근교, 트라카이 캐슬 투어를 떠나보세요!","발트 3국 중 리투아니아, 리투아니아의 빌뉴스빌뉴스 여행에서 빠질 수 없는 트라카이 캐슬을 소개해드릴게요.3000여 개의 호수를 지닌 리투아니아의 명소 중의 명소 ,여름엔 푸르름을 지닌 호수를, 겨울엔 새하얀 눈꽃을 덮은 호수를 볼 수 있어요.그 가운데 세워진 성 내부에는 리투아니아의 역사를 알아 볼 수 있는 박물관이 있으며 성 외곽에는 잠시 쉬었다 갈 수 있는 공원이 형성되어 있습니다.또한 트라카이 주변에는 오래 전부터 리투아니아인들에게 사랑받은 먹거리, 키비네이와함께 마시면 더욱 맛있는 리투아니아인들의 전통 음료, 기라를 즐길 수 있습니다.투어 내용숙소 픽업차량 이동(빌뉴스트라카이, 30분 소요)트라카이 개인 투어(옵션1. 성 내부 및 박물관 투어: 입장료 불포함)(옵션2. 트라카이 맛집, 키비네이 레스토랑: 식대 불포함)차량 이동(트라카이빌뉴스, 30분 소요)총 예상 소요시간옵션1. 2시간 30분옵션2. 3시간본 투어에는 가이드 내용이 포함되지 않으며,빌뉴스에서 트라카이까지 차량이동 서비스가 제공되는 투어로추가로, 성 내부 투어와 레스토랑 투어를 선택할 수 있습니다.(옵션: 시간 조절을 위해 필수적으로 사전에 선택되어야 함)","리투아니아에 대해 여러모로 궁금한 점이 많았는데 가이드님이 친절하게 설명해주셔서 여쭤보기가 한결 수월했습니다 트라카이성 내부 관람을 했는데  가이드님이 먼저 일정을 조정해주실 수 있다고 하여 원래 예정된 시간보다 더 많은 시간을 투어하는데 할애할 수 있었습니다 일정이 촉박한 와중에 빌뉴스에서 트라카이성까지 차로 빠르고 편안하게 다녀올 수 있었습니다  그리고 가이드님이 사진도 많이 찍어주셨습니다^^ 트라카이 캐슬 투어 강추합니다!!현지 전통 음식과 도시와 관련된 많은 정보를 주셔서 즐겁게 여행했습니다.성 입장료 성인8유로 학생4유로 미취학 아이 무료. 성은 두 부분으로 나뉘어 각각의 영역에 박물관이 있음. 안쪽 박물관에 역사를 알 수 있는 그림, 갑옷 무기류 전시.  리투아니아 역사를 알 수 있어서 좋았음. 안쪽 성 가는 다리 우측 쪽문으오 내려가면 활쏘기 체험공간. 인당 2유로에 5발. 공기총/활/화살을 총처럼 쏘는 활?의 세 종류. 재미 있네요. 7살 아이용 활과 과녁도 있어서 즐거운 체험이었음. ",자연,Ex,혼자
57624,Lithuania,Vilnius,가이드 투어,[투어] 빌뉴스와 트라카이 한나절 둘러보기 (리투아니아/빌니우스),"리투아니아의 대표적 관광 명소는 현재 수도 빌뉴스의 구시가지와 옛 수도 트라카이입니다. 빌뉴스는 1323년 리투아니아 대공국의 개디미나스에 의해 세워졌습니다. 리투아니아 대공국은 1417세기 발트해에서 흑해까지 유럽에서 가장 넓은 영토를 가졌습니다. 그때부터 빌뉴스는 이 일대의 정치, 경제, 문화, 종교의 중심지입니다. 구시가지는 유네스코 세계문화유산지로 북유럽에서 가장 넓은 중세 구시가지 중 하나입니다. 수많은 역사의 굴곡으로 풍부한 이야기를 담고 있습니다. 먼저 빌뉴스 구시가지에 있는 새벽의 문  검은 마리아, 다종교 공존의 거리 (로마 가톨릭교, 러시아 정교, 그리스 정교 성당), 최초 바르코 건축물 카지미애라스 성당, 구시청 광장, 독특한 조각품으로 장식된 문학인의 거리, 후기 고딕의 걸작품 안나 성당과 베르나르드 성당, 구시가지 핵심 거리 중 하나인 필리스 거리, 1579년 세워진 빌뉴스대학교 (내부 입장 추천), 리투아니아 대통령 궁,  신고전주의 건축물 빌뉴스 대성당과 르네상스 건축물 통치자 궁전 등을 둘러봅니다. 이이서 차량으로 빌뉴스에서 서쪽 28km 떨어진 트라카이로 이동입니다. 트라카이(Trakai)는 빌뉴스 이전 리투아니아 대공국의 수도였던 곳입니다. 특히 이곳에는 14세기 말 흑해 크림 반도에서 이주해온 카라임족이 정착한 한 곳입니다. 이들은 유대교를 믿는 투르크계에서 분파된 민족입니다. 호수 가운데 있는 섬에 세워진 붉은 벽돌 성은 발트해에서 흑해까지 이르는 넓은 영토를 확보한 비타우타스(13501430) 대공작이 거주하고 사망한 곳입니다. 반도에 있는 성과 함께 리투아니아 대공국(13세기18세기)의 중심지이자 군사적 요충지입니다. 17세기 모스크바 공국과의 전쟁으로 파괴되었고 현재 건물은 수십년에 걸쳐 1960년대에 복원된 것입니다.트라카이를 둘러싸고 있는 큰 호수는 모두 3개입니다. 타타르 호수, 갈베 호수, 루카 호수입니다. 특히 루카 호수는 하늘에서 내려다 보면 한반도 지형을 꼭 닮았습니다. 먼저 이 호숫가 산책으로 트라카이 여정을 시작합니다. 이어서 트라카이 반도에 있는 성 주변 산책, 방어적 기능의 섬 성 (내부 입장), 섬 성 주변 도보 혹은 요트 타기로 들러보기, 카라임 거리 산책 및 카라임 전통 음식 맛보기로 진행됩니다. ""유럽의 중앙  리투아니아"" 책 저자이자 리투아니아 관광청 공식 가이드 자격증 소지자이며 또한 트라카이 성 가이드 자격증을 갖춘 제가 정성껏 안내해 드리겠습니다.차량 운전은 가이드의 리투아니아인 아내 Vida가 맡아서 합니다.음학학교에서 피아노를 가르치고 있습니다. 여행 중 리투아니아 현지인의 삶을 리투아니아 현지인을 통해서 들을 수 있는 좋은 기회가 될 것입니다.차량 정보  BMW 520D (운전은 현지인)적정인원 2~3명  대형캐리어 2개 + 소형캐리어 2개 가능  유아 카시트 없음",개별여행으로 아주 탁월한 선택이영던거 같습니다,도시,Kn,허니문
14538,Lithuania,Vilnius,가이드 투어,빌니우스 : 현지인과 함께 리투아니아 워킹 투어 ," 본 투어는 영어로 진행되며, 다국적 여행자들과 함께하는 단체 투어로 진행됩니다.  여행 확인증이 아닌, 영어로 된 바우처를 지참하셔야 합니다.  만 6세 이하의 아동은 이 투어에 참여할 수 없습니다. [ 이 투어의 매력 포인트! ] 리투아니아에서 잡아올린 생선으로 만든 훈제 혹은 건조 요리 로컬 맛집에 들러보세요! 로컬들이 가장 좋아하는 가게에서 최고의 맥주를 맛보세요! 올드 타운의 거리에서 여러 문화들이 어우러지는 광경을 만나보세요! 로컬 힙스터들이 그들만의 나라를 선포한 곳을 방문해보세요! 나폴레옹의 마음을 사로잡은 성당을 둘러보세요![ 투어 코스 ]넋을 빼놓을 정도로 멋진 도시인 빌니우스의 현대적이고 고전적인 동네, 역사적 명소, 그리고 새로운 랜드마크 등을 둘러보며 다양한 모습을 발견해보세요! 빌니우스 로컬이 이 도시의 오늘날을 이루고 있는 많은 이야기들을 소개해줄 것입니다.빌니우스의 올드 타운은 리투아니아, 폴란드, 러시아, 그리고 유대교 문화까지 모두 어우러진 매력적인 곳으로, 여러 성당, 상점, 요리, 그리고 종교에 그 흔적들이 남아있습니다. 자갈길을 거닐며 수세깆 전 중세에 이곳이 번성했을 당시의 모습을 상상해보세요. 또한 나폴레옹이 방문한 뒤 옮겨가고 싶어할 정도로 마음에 들어 한 성 안나 성당에 잠시 멈춰 이를 감상해보세요!그 후에는 예술가, 음악가, 그리고 자유로운 영혼의 여행자들이 모인 독립적인 구역 우주피스(Uzupis)에서 힙스터와 보헤미안의 분위기를 체험해보세요. 이곳은 스스로 독립적인 우주피스 공화국이라 자칭하며, 이곳만의 대통령, 수상, 헌법, 그리고 4월 1일 만우절인 독립기념일까지도 가지고 있습니다. 거친 거리 예술, 색색의 카페, 생동감 넘치는 벽화, 매력적인 현지인들, 그리고 그림들로 가득한 갤러리는 이곳을 사진작가들에게 인기 있는 지역으로 만들어 줍니다. 그러니 카메라를 잊지 마세요! 이곳에서 우주피스의 독특함을 자아내는 이색적인 장소들과 개성 넘치는 볼거리들을 담아보세요. 우주피스와 조금 익숙해지면, 올드타운으로 돌아가 빌니우스 투어의 멋진 마무리를 장식할 것입니다. 바로 작은 지역 맥주 양조장에 들러 리투아니아의 전통 별미와 지역 맥주를 맛보는 것입니다! (아이들을 위한 무알콜 음료수도 있답니다.)투어의 마지막에는 놓치면 안될 중요한 포인트나 펍, 혹은 식당에 대해 가이드에게 마음껏 물어보세요!   예약 방법  캘린더에서 이용 일자와 인원을 선택해 주세요. 예약 확정 후 '예약 내역' e티켓(바우처)에서 만나는 시간 및 장소를 반드시 재확인하시기 바랍니다.","빌뉴스를 제대로 보고싶으면 꼭 이 투어룰 신청하셔야해요. 빌뉴스 가이드가 친절하게 모든 관광지, 역사, 리투아니아인의 문화까지 잘 설명해줍니다. 사려깊고, 배려많은 가이드 덕분에 편하고 재미있게 여행할 수 있었어요. 투어가 끝나고도 제가 가보고 싶다고 한 샵과 추천할 만한 곳을 다 링크로 정리해서 메일 보내준거에 감동. 우주피스 여행할 때는 너무 좋았어요 딱 제가 오고 싶었던 곳이라. 추천합니다.",도시,Sh,혼자
14458,Lithuania,Vilnius,가이드 투어,빌니우스 : 여행하는 미식가들을 위한 3시간 미식 탐험!," 본 투어는 영어로 진행되며, 다국적 여행자들과 함께하는 단체 투어로 진행됩니다. 여행 확인증이 아닌, 영어로 된 바우처를 지참하셔야 합니다.  아동을 동반하실 경우, 만 6세 이상이어야 합니다. 만 6세 미만의 아동은 투어 예약이 불가능합니다. [ 이 투어의 매력 포인트! ] 유럽에서 가장 잘 보존된 신비로운 도시 중 한 곳인 빌니우스의 숨은 명소들을 찾아보세요! 맛있는 풍미를 찾아 올드 타운의 미로 같은 길을 거닐어 보세요! 최소 5가지의 음식과 음료를 맛보며 즐거움을 느껴보세요! 유기농 농작물, 집에서 직접 만든 케이크, 그리고 사랑을 담아 만들어진 음식들을 즐겨보세요! 빌니우스 올드타운의 가장 특별한 요리인 훈제 고기, 생선, 그리고 치즈를 직접 맛보세요! 평범한 주당에서 리투아니아 최고의 지역 술 비평가로 거듭나보세요! 고딕 양식과 중세 시대의 건축물을 감상해보세요![ 투어 코스 ]반나절 음식 투어를 통해 빌니우스의 숨은 보물들을 만나보세요! 그리고 지역의 풍미를 느끼는 동안 빌니우스만의 특색 있는 건축물과 문화적 유산들 역시 둘러볼 수 있습니다!소비에트 시기의 상흔에도 불구하고, 가장 오래된 발트해 국가인 리투아니아는 음식에 대한 깊은 전통을 자랑합니다. 이곳은 간단하지만 맛있는 요리들로 유명합니다. 워킹 투어는 바로크와 고딕 양식의 멋진 빌니우스 올드타운에서 시작됩니다. 유네스코 세계문화유산으로 등재된 좁다린 길들을 지나며 로마, 예루살렘, 그리고 아테네와 비슷한 모습들을 찾아보세요.장엄한 성당 광장(Cathedral Square)에서부터 리투아니아 음식의 맛을 발견해보면서 이 도시의 매력적인 역사에 대해서도 배워보세요. 도토리 커피, 차가운 분홍 수프 등 최소 5가지의 서로 다른 음식과 음료를 맛볼 수 있습니다. 다양한 상점부터 식당까지, 카페부터 바까지, 곳곳을 여행해보며 리투아니아가 전세계 요리에 끼친 영향을 발견해보세요. 둘이 먹다 하나가 죽어도 모를 정도로 스튜가 맛있더라도, 리투아니아의 숲에서 잡은 여러 육류와 가금류 요리도 절대 놓치지 마세요!중세시대부터 현대에 이르기까지 빌니우스의 전통 요리를 맛본 후에는, 가이드로부터 절대 놓치면 안될 진짜 리투아니아의 맛과 멋을 담은 먹거리와 장소에 대한 팁을 들어보세요!  예약 방법  캘린더에서 이용 일자와 인원을 선택해 주세요.  예약 확정 후 '예약 내역' e티켓(바우처)에서 만나는 시간 및 장소를 반드시 재확인하시기 바랍니다.",빌니우스 현지여행상품으로 추천합니다.,도시,Fo,혼자
29239,Bulgaria,Sofia,가이드 투어,"불가리아 소피아 투어, 역사 속으로 산책!","본 투어는 칠천년의 역사를 소유하고 있는 발칸의 진주, 소피아의 중심지를 탐방합니다. 현지인과 같은 스킬로 여행자들에게 흥미로운 역사 워킹투어 뿐만 아니라, 이곳의  다양한 문화를 소개해드리며 현지인으로서 하루를 체험할 수 있도록 해드립니다. 워킹투어인만큼 지루하지 않고 정말 다채로운 명소들을 방문하며 역사 속으로 돌아가 이곳의 스피릿을 느껴볼 수 있는 아주 값진 경험이 될 것입니다. 시작점은 대통령 궁 앞 분수대.  대통령궁  구왕궁  구공산당 서기장 묘터 벼룩시장  사무엘왕의 병사들 광장 알렉산더 넵스키 성당  성소피아 성당  로마원형극장  (일부) 온천약수터  로마시대의 유적 지하교회  구레닌광장  비토샤 명동 거리모든 명소들은 도보로 10 15분 정도 걸리며, 총 4시간 워킹 투어입니다.커피 및 식사 비용은 불포함입니다.","소피아 시내 주요한 곳을 빠짐없이 다닐수 있습니다. 3시간 걷는게 조금 힘드실수 있겠지만, 그래도 가장 완벽한 코스라 생각 됩니다.불가리아의 역사와 문화를 알 수 있어서 좋았습니다소피아의 모든 것을 단시간에 역사적인 배겅설명을 포함하여 안내 받아 감사합니다",도시,Kn,허니문
