ISBN,int
9788901219943,"인생의 터닝포인트를 위해 가장 중요한 것만 남기고 모두 지워버리는 법! 현재 미국에서 가장 주목받는 인플루언서 마크 맨슨은 『신경 끄기의 기술』을 통해, 기존의 자기계발서를 뒤집는 신선한 패러다임을 선보인다. 무조건 믿고 노력하는 것만으로 인생이 특별해지거나 행복해지는 것은 아니며, 앞뒤 따지지 않는 긍정은 오히려 독이라는 것이다. 때론 내려놓고, 포기하고, 더 적게 신경 써야만 인생에서 진짜 중요한 것들을 발견할 수 있기 때문이다. 저자는 학창 시절 마약 문제로 퇴학까지 당했던 문제아였고 대학 졸업 후에도 한동안 백수로 지내며 인생의 목표를 찾지 못했지만, 현재는 180도 다른 인생을 살고 있다. 200만 명 이상의 팔로워를 거느린 그의 미디어 파워는 메이저 언론에 버금갈 정도이며, 그에게서 인생의 답을 찾으려 하는 대중들의 이메일이 매일 수천 통씩 쇄도한다. "
9791196588502,"유튜브 누적뷰 8천만 기록, tvN 《어쩌다 어른》, CBS 《세상을 바꾸는 시간, 15분》 등을 통해 많은 이를 긍정적 변화로 이끈 힐링 퍼포먼스의 일인자 김창옥의 핵심 강의 『지금까지 산 것처럼 앞으로도 살 건가요?』. 그동안 변화와 소통을 주제로 강연하며 변화의 메시지를 전달해온 저자는 이 책을 통해 인생의 돌부리에 걸려 자꾸 넘어지는 것 같은 이들에게, 주체적으로 삶을 살고자 하는 이들에게, 참된 나를 찾길 원하는 이들에게 인생의 새로운 페이지를 열어준다."
9791185584454,"주 4시간만 일하며 새로운 일과 삶의 방식을 개척한 《타이탄의 도구들》의 저자 팀 페리스. 그가 전하는 최소한만 일하고 원하는 대로 사는 법 『나는 4시간만 일한다』. 디지털 노마드, 즉 인터넷의 보급과 기술의 발전으로 원격 근무를 하면서 시간과 공간을 자유롭게 선택하며 일하는 방식의 선구자이자 지금도 선도자로서 성공적인 인터넷 기업가로 활동하는 저자는 이 책에서 가장 적은 노력과 비용으로 선택의 권리를 찾고 만들어 내는 모든 방법에 대해 이야기한다."
9791190630092,
9791160507386,"적어도 주중 하루 9시간 이상을 퇴근 전에 사용하는 직장인에게는 퇴근 후의 시간을 즐겁게 보내는 계획만큼이나 퇴근 전의 시간을 제대로 똑똑하게 쓰는 방법이 중요하다. 올리는 기획안은 모조리 반려되고, 고작 5페이지 분량의 보고서는 팀장에게 난도질을 당하며 회사에서 끔찍한 시간을 보냈다면, 퇴근 후 두 시간의 취미생활이 아무리 만족스럽다 해도 삶은 여전히 고단할 수밖에 없다. "
9788901240121,"당신은 더 나은 미래를 위해 전혀 노력하지 않는가. 정말 노력하지 않아서 불만족한 삶에 자족하며 사는가. 아니라고 잘라 말할 수 있다. 우리들은 노력한다. 사이사이 고민도 하고, 유명하다는 책도 들춰 보고, 원대한 계획도 종종 세워본다. 하지만 늘 머무르고 싶은 마음이 다르게 살아보겠다는 다짐을 이긴다. 오늘 아침의 당신처럼. 사실 어쩌면, 인생이 두서없이 흘러가는 동안 당신이 제대로 개입한 적은 한 번도 없었는지 모른다. 비하하려는 게 아니라 인정해야 할 사항을 말하는 것이다. 그동안 당신이 무슨 짓을 했건, 하지 않았건 그것은 현실의 변화를 끌어낼 수 있을 만큼의 실질적인 힘이 없었다. 정말로 이 짓을 끝내고 싶다면 확고한 결심이 필요하다. 지금까지 살아온 삶을 이제는 더 이상 계속할 수 없다는 생각을 스스로에게 단단히 심어주어야 한다."
9791162541210,"26살, 9개월 만에 사법시험을 패스한 이윤규 변호사가 자신의 경험을 바탕으로 어떤 시험이든 가장 빠르게 합격하는 방법을 알려주는 『나는 무조건 합격하는 공부만 한다』. 수능, 내신, 공시, 행시, 임용고시, 각종 자격증까지 시험공부를 하고 있는 사람들에게 저자가 직접 행하고 효과를 본 노하우를 소개해 가장 빠르고 효율적으로 합격에 이르는 길을 찾을 수 있도록 도와준다."
9791190227032,리더들의 성공비결 논리학을 주목하라! 
9788927811053,
9791185952987,"사람마다 가지고 있는 자신의 말 그릇의 의미에 대해 생각해보고 어떻게 하면 나의 말 그릇을 보다 단단하고 깊이 있게 만들 수 있는지 알려주는 『말 그릇』. SK, LG, 삼성을 비롯한 수많은 기업과 개인 코칭을 해온 코칭심리학자 김윤나가 이와 같은 경험을 통해 얻은 말에 대한 근본적인 성찰을 담은 책이다."
9791162540633,"평균보다 떨어지는 IQ, 특별할 것 없는 재능, 불우한 가정환경에도 놀라운 성공을 일궈낸 사람들은 어떻게 그 모든 불리함을 극복하고 최고의 자리에 오를 수 있었을까? 반면, 일류대를 나온 부모, 천재적인 재능 등 성공할 수 있는 모든 조건을 갖춘 것 같아 보이는 사람들이 그저 그런 성취에 머물고 마는 까닭은 무엇일까? 펜실베이니아 대학교의 선구적인 심리학자 앤절라 더크워스는 성공을 추구하는 사람들의 필독서인 『그릿(Grit)』에서 성공의 비결은 재능이 아니라 그녀가 ‘그릿’이라고 부르는 열정과 끈기의 조합에 있음을 보여준다. "
9791135462245,
9788901230658,‘너는 게을러. 너는 멍청해. 너 정도로는 안 돼’ 
9791162540640,"단계적이고 체계적인 자기계발 방법을 찾는 사람들을 위한 『아주 작은 습관의 힘』. 고교 시절 촉망받는 야구선수였던 저자는 연습 중 동료의 야구 배트에 얼굴을 정통으로 강타당하는 큰 사고를 당했고, 걸을 수조차 없었던 저자는 절망에 빠지는 대신 지금 당장 할 수 있는 아주 작은 일이라도 찾아 그것을 반복하자고 마음먹었다. 그 후 매일 걷기 연습을 해서 6개월 만에 운동을 할 수 있게 되었고, 6년 후에는 대학 최고 남자 선수가 되었다. "
9791188331826,"『당신의 삶에 명상이 필요할 때』는 파란 눈의 스님 앤디 퍼디컴이 인생의 모든 해답이 나 자신의 내면에 있다는 걸아는 이들, 즉 명상법을 배우려는 이들을 위해 집필했다. 10개 나라에서 출간된 이 책이 해외 언론의 주목을 받게 된 계기에는 빌 게이츠와 엠마 왓슨이 있다. 그들은 자신의 내면의 답, 오직 나만의 길을 직시하고 싶어 했고 명상이 가장 확실한 방법임을 알고 있었다. 이 책은 그런 면에서 탁월한데, 저자 자신이 승려가 되고 명상을 수련하며 겪은 시행착오로 터득한 가장 쉽고 정확하게 명상할 수 있는 방법을 담았다. "
9791188388905,"인공지능이 인간을 넘어서는 시대, 무엇을 준비할 것인가? 또 어떻게 살아남을 것인가? 세상을 지배하는 0.1%의 인문고전 독서법을 소개한 《리딩으로 리드하라》, 5천 년 역사를 만든 동서양 천재들의 사색공부법을 내세우며 전작의 실전편이라 할 수 있는 《생각하는 인문학》을 선보인 이지성이 그 무엇과도 대체되지 않는 삶을 선택하기 위해 노력하는, 이 시대 모든 사람들에게 세계 상위 0.01%가 실천 중인 ‘에이트’를 제안하는 『에이트』."
9791190382175,"부와 행운을 만나는 출발점, 마법의 감정 Having! 국내 최초로 미국에서 선(先)출간되어 세계가 먼저 찾아 읽은 『더 해빙(The Having)』. 세계적인 부자들이 성공 비결로 꼽았다는 ‘운’. 행운은 타고나는 것일까? 소수에게만 주어지는 것일까? 물려받은 재산도, 특출난 재능도 없는 사람도 부자가 될 수 있을까? 대기업 창업주와 주요 경영인, 대형 투자자가 절체절명의 순간 찾는 사람, 이서윤. 그들은 그녀에게 자문을 구한 뒤 일생일대의 기회를 잡는 인생의 퀀텀 점프를 이루어냈다."
9788983711892,"과학 교양서의 고전『코스모스』. 이 책에서 저자는 우주의 탄생과 은하계의 진화, 태양의 삶과 죽음, 우주를 떠돌던 먼지가 의식 있는 생명이 되는 과정, 외계 생명의 존재 문제 등에 관한 내용을 수 백장의 사진과 일러스트를 곁들여 흥미롭게 설명한다. 현대 천문학을 대표하는 저명한 과학자인 저자는 이 책에서 사람들의 상상력을 사로잡고, 난해한 개념을 명쾌하게 해설하는 놀라운 능력을 마음껏 발휘한다. "
9791155424353,우한발 신종 코로나 바이러스 분석과 대응책 긴급 업데이트!
9788962622508,"‘물리’라는 과학의 언어를 통해 세계를 읽고 생각하는 또 다른 방법을 안내하는 『떨림과 울림』. 빛, 시공간, 원자, 전자부터 최소작용의 원리, 카오스, 엔트로피, 양자역학, 단진동까지 물리에서 다루는 핵심 개념들을 차분히 소개하면서 물리라는 새로운 언어를 통해 우리 존재와 삶, 죽음의 문제부터 타자와의 관계, 세계에 관한 생각까지 새로운 틀에서 바라볼 수 있게 안내한다."
9788934971368,"치명적 신종, 변종 바이러스가 지배할 인류의 미래와 생존 전략 《바이러스 폭풍의 시대》. 독창적 생물학자이자 세계적인 바이러스 전문가인 네이선 울프가 밝힌 파괴적 살인 바이러스의 정체에 대해 이야기한다. 저자는 전염 바이러스에 관한 새로운 접근 방식, 날카로운 통찰력으로 인류를 괴롭히는 대유행 전염병 바이러스의 행로를 바꿀 강력한 방안을 제시하고 있다."
9791190403283,"1980년과 2014년 전 세계 181개국에 방영되어 전 지구적 과학 붐을 일으킨 전설적인 다큐멘터리 「코스모스」. 칼 세이건과 앤 드루얀이 함께 기획하고 펴낸 이 다큐멘터리와 동명의 책은 40년 넘게 시대와 세대를 초월해 가며 10억 이상의 시청자와 독자 들의 지적 호기심을 충족시켜 주었을 뿐만 아니라, 감정도 충만하게 채워 주었고, 과학이 역사와 문화, 그리고 사회와 깊이 얽혀 있음을 생생하게 보여 주었다. 칼 세이건이 떠난 지 20여 년이 지났지만 앤 드루얀은 지금도 「코스모스」 시리즈의 정신을 지켜 가며, 시청자와 독자 들을 140억 년의 장구한 시간과 수백억 광년의 광막한 공간을 가로지르는 위대한 여행으로 우리를 안내하고 있다."
9791188850808,"2019년 미국 노동통계국이 발표한 2028년까지 가장 유망한 직업 스무 가지 목록에 ‘수학자’와 ‘통계학자’가 이름을 올려 화제가 되었다. 수학자와 통계학자뿐 아니라 최근 전 세계적으로 주목받는 ‘데이터 과학자’와 ‘개발자’ 같은 직군 또는 IT 관련 업계에서 일하려면 수학적 사고력이 반드시 필요하다. 디지털과 인공지능 시대에 수학 지식, 나아가 수학적 사고력은 더 이상 특별하게 똑똑한 천재의 전유물이 아닌 것이다. 점점 복잡해지는 세상의 이면에는 다양한 수학적 사고와 판단이 숨어 있고 모두가 그 원리를 이해하고 삶에 활용할 필요가 있다. 입시 목적의 문제 풀이 위주 교육 후유증을 앓고 있는 ‘수포자’ 신세에서 벗어나, 세상의 본질을 분석하고 이해하는 수학의 세계와 친해지는 것은 이제 선택이 아닌 필수다."
9791159922947,"올리버 색스의 대표작『아내를 모자로 착각한 남자』.올리버 색스의 저술들은 모두 신경장애라는 매우 전문적인 분야를 다루면서도, 문학적으로도 높은 평가를 받으며 특유의 흥미진진함으로 독자들의 사랑을 받아왔다. 뿐만 아니라 프랑스에서 세계적 연출가 피터 브룩(Peter Brook)에 의해 희곡으로 각색되어 무대에 오르는 등 끊임없이 다양한 장르의 예술 창작을 낳는 모태가 되었다. 시, 소설, 춤, 그림, 영화, 연극, 오페라 등 여러 분야에서 활동하는 예술가들이 스스로 올리버 색스의 작품에서 영감을 받았다고 밝힌 것도 어쩌면 당연하다. 지금도 미국 대학에서는 신경학 분야뿐 아니라 문학, 윤리학, 철학 등의 교과과정에서 그의 글을 교재로 채택하고 있다. "
9788952773326,"과학은 지겹고 어렵다? 하지만 미국의 사이언스 웹툰 xkcd에서는 그러한 편견을 깨준다. 이곳에서 저자 랜들 먼로는 궁금했지만 누구도 대답해 주지 않는 기상천외한 질문들에 답을 해준다. ‘실제로 광속구를 던지면 어떤 일이 벌어지나?’, ‘몸속 DNA가 사라지면 어떻게 될까?’ 등 물리학, 화학, 천체물리학 등을 아우르는 황당하고 엉뚱한 과학이 랜들 먼로와 함께라면 흥미진진해지며 과학에 대한 편견을 깨뜨릴 수 있다."
9788932473901,"1976년, 처음 출간되었을 당시 과학계와 일반 대중들에게 폭발적인 반향을 불러일으키며 세기의 문제작으로 떠오른 『이기적 유전자』는 40년이라는 세월의 검증을 거치며 그 중요성과 깊이를 더욱더 확고하게 인정받았고, 25개 이상의 언어로 번역되었으며 젊은이들이 꼭 읽어야 할 과학계의 고전으로 자리 잡았다. 새로운 디자인과 휴대하기 좋은 판형으로 갈아 입은 이번 40주년 기념판에 새롭게 수록된 에필로그에서 저자는 여전히 ‘이기적 유전자’라는 개념이 갖고 있는 지속적인 타당성을 이야기하며 이 책이 전하는 메시지를 되새긴다."
9788996588733,"『정재승의 과학 콘서트』는 분야를 넘나드는 통합적 지식과 사유를 보여주며 세대를 초월해 즐길 수 있는 지식논픽션으로, 많은 독자들에게 사랑받으며 교양 과학 필독서로 자리 잡은 책이다. 일상과 전문 지식, 과학과 여타 학문들을 넘나드는 통합형 지식으로 복잡한 물리 법칙이나 수학을 전혀 못 해도 쉽게 이해할 수 있도록 한 것이 특징이다. 과학과 여러 학문을 아우르는 크로스오버적 접근과 당연하다고 생각되는 사회현상을 전혀 다른 각도에서 의심하는 기발한 질문으로 세상에 대한 새로운 지식을 선사한다."
9791186560785,"한국인 최초 옥스퍼드 대학 정교수이자 세계적인 수학자 김민형 교수의 명강의 『수학이 필요한 순간』. 인간의 사고 능력을 확장시켜온 수학이라는 장대한 세계에 관한 7개의 명강의를 담은 책이다. 옥스퍼드 수학과의 명강의를 포함하여 저자가 한국에서 진행한 각종 수학 강의의 내용을 바탕으로 탄생한 것으로, 마치 강연의 현장에 찾아온 듯 수학에 대해 묻고 답하는 세밀한 대화로 가득하다. "
9788965706205,"일반상대성이론을 양자이론과 통합한 새로운 시각에서 현대 물리학계의 최신 흐름을 담아낸 『보이는 세상은 실재가 아니다』. 《모든 순간의 물리학》의 저자 카를로 로벨리의 두 번째 책으로, 고대부터 오늘날까지 위대한 인류가 걸어온 미지의 영역에 대한 호기심과 상상력의 여정을 기록하고 있다. "
9788970129341,"세계적 석학 재레드 다이아몬드 교수의 과거와 미래에 대한 진화론적 통찰과 전망『제3의 침팬지』. ‘인간과 침팬지의 유전적 차이는 단, 1.6%’에서 시작하는 인류 진화의 역사를 명쾌하고 재미있게 풀어쓴 《제3의 침팬지》 신장판이다. 이 책은 1996년 초판을 21세기의 상황에 맞게 개정 출간한 것으로, 2013년 현행 표준국어대사전의 표기법, 띄어쓰기 및 외래어표기법에 맞게 용어를 정리하였고, 표와 그림을 새로 작업하여 한층 세련된 감각으로 디자인되었다."
9791155811887,"하버드대 뇌과학자인 질 볼트 테일러. 어느 날 그는 찌르는 듯한 두통으로 아침을 맞는다. 일상적 활동을 하려 하지만 옷을 입기도, 목욕을 하기도, 전화를 걸기도 어렵다. 찾아온 건 중증 뇌출혈. 뇌가 무너지는 과정을 몸소 느껴볼 수 있다는 생각에 하나하나 놓치지 않고 진행 과정을 꼼꼼히 관찰한다. 병원으로 옮겨진 그는 대수술을 받고 8년간 뇌의 기능을 되찾는 회복기를 거친다."
9791160803204,"‘양자역학’ 하면 ‘슈뢰딩거의 고양이’를 떠올리는 사람은 많을 것이다. 그럼 ‘슈뢰딩거의 고양이’ 실험이 무슨 내용인지, 양자역학에서 어떤 상징성을 가지는지 제대로 이해하고 설명할 수 있는 사람은 과연 얼마나 될까? 《슈뢰딩거의 고양이를 찾아서》는 《네이처》, 《스펙테이터》가 선정한 최고의 과학저술가이자, 과학 대중화에 기여한 공로로 미국과학진흥회의 공로상을 수상한 존 그리빈의 대표작으로 1984년에 초판이 출간된 이래로 독자들이 꾸준하게 찾아 읽어온 양자역학의 고전이다."
9791187150640,"물리학은 만물의 이치를 탐구하는 학문이다. 구름은 어떻게 생성되는지, 사물의 형태나 색을 어떻게 인지하는지, 소리는 어떻게 전달되는지, 자전하는 지구에서 어떻게 떨어지지 않고 버틸 수 있는지……. 물리학자는 자연과 우주의 본질을 탐구하는 사람들이다. 만물의 본질을 각자의 언어로 궁구(窮究) 한다는 차원에서 과학자의 일과 예술가의 일은 다르지 않다."
9788988804674,"『하리하라의 생물학 카페』는 27살의 젊고 발랄한 여성 과학도가 일반 독자들에게 요즘 주목받는 생물학 관련 키워드들을 쉽고 재미있게 풀어 써내려간 과학 에세이다. 이 책의 가장 큰 특징은 바로 ‘열린 글쓰기, 우리들의 피부에 와닿는 친근한 글쓰기’를 하고 있다는 점이다. 탄생과 노화, 비만, 진화, 유전자, 탄저균, 인공 생명 등 각종 생물학적 주제들을 관련 그리스 신화와 연결지어 흥미롭게 설명한다."
9788997382163,"『미술관에 간 화학자』는 과학자의 눈으로 본 미술에 관한 이야기, 미술과 함께하는 과학에 대한 이야기를 담은 책이다. 명화 속에서 만나볼 수 있는 화학에 대한 흥미진진한 이야기를 들려주며 미술의 태생적 기원을 화학에서 찾아보고자 한다. 에이크, 밀레, 휘슬러, 미켈란젤로, 브뢰헬, 틴토레토 그리고 김홍도, 신윤복, 장승업 등 우리 화가들까지 조명하며 명화에 담긴 과학에 대해 재미있게 이야기하고 있다."
9788993543810,"이 책은 “Introduction to Quantum Mechanics, 3/e(David J. Griffiths 저)”을 번역한 것이다. "
9791157843404,"과학 웹툰 《곤충의 진화》의 저자 김도윤(갈로아)가 새롭게 펴낸 『공룡의 생태』. 미래의 공룡학자나 고생물학자와 과학자가 되고 싶은 학생은 물론 어른들이 보기에도 거부감 없는 과학교양서로, 생물학을 전공하는 저자가 《곤충의 진화》에서 다뤘던 특유의 패러디와 드립을 그대로 녹여내면서도 무시무시할 정도로 철저한 고증을 거쳐 공룡의 피부색, 성생활, 공룡이 거대해진 이유, 깃털을 가진 공룡, 공룡의 체온 등 일반인은 잘 모르지만 흥미진진한 최신 공룡 연구를 광범위하게 다뤘다."
9788962184471,▶ 이 책은 일반화학을 다룬 이론서입니다.
9788955889369,"화학의 기본 개념을 한 권으로 알차게 정리한 화학책이 출간되었다. 그린북 ‘과학 사전’ 시리즈의 다섯 번째 책 《개념, 용어, 이론을 쉽게 정리한 기초 화학 사전》이다. ‘과학 사전’ 시리즈는 물리, 화학, 천문학, 수학 등 자연과학 각 분야의 기본 원리를 한 권으로 정리하여 청소년, 전공자, 과학 애호가들에게 좋은 반응을 얻고 있다. 앞서 나온 《물리ㆍ화학 사전》이 법칙과 공식을 중심으로 정리하여 학습 활용도를 높였다면, 이번 신간은 기본 개념을 풀이하는 데 초점을 맞추었다. 만약 법칙과 공식 중심의 학습을 버겁게 느꼈던 독자라면, 기본 개념이 확실하게 잡혀 있지 않을 가능성이 높다. 이번 책 《기초 화학 사전》으로 기초를 단단히 다지고 나면 교과나 전공에서 보다 수월하게 응용하고 확장시킬 수 있을 것이다. 저자는 화학을 지루한 암기 과목으로 여겼던 독자들에게도 꼭 한번 이 책을 읽어 보라고 권한다. 20여 년간 화학을 가르치며 체득한 노하우를 아낌없이 담아, 누구라도 화학의 ‘신선한 발견’을 할 것이라 자부하고 있다."
9788955883398,"법칙, 원리, 공식을 쉽게 정리한 『물리 화학 사전』은 고등학교 과학 시간에 배우는 물리ㆍ화학의 법칙ㆍ원리ㆍ공식을 기본부터 차례대로 정리하여 담은 사전이다. 현대 과학의 기본이 되는 이 법칙ㆍ원리ㆍ공식을 날실로 삼아 파악해 두면 지식이 머릿속에 정리되고 넓은 시야를 얻을 수 있으며, 새로운 지식을 접할 때에도 이해하기가 한층 쉬워진다. 현대의 물리ㆍ화학에 기본이 되는 70가지 아이템으로 세상을 더욱 폭넓게 이해해 보자."
9788956602189,
9791190467100,· 지금 하늘에는 비행기가 몇 대나 떠 있을까?
9791188731114,▶ 이 책은 일반화학을 다룬 이론서입니다. 일반화학의 기초적이고 전반적인 내용을 학습할 수 있습니다.
9788934970576,"이론물리학계의 세계적 석학이자 과학 엔터테이너 미치오 카쿠가 이번에는 『마음의 미래』에서 인간 의식세계의 비밀을 파헤친다. 저자는 그동안 많은 도서를 집필하는 동안 ‘인간의 마음은 우주에서 가장 위대하고 신비로운 힘’이라는 생각이 맴돌았다고 한다. 이에 ‘마음의 실체는 무엇이며 어떤 식으로 작동하는가?’, 그리고 ‘나는 누구이고 지금 어디에 있는가?’ 이 같은 물음을 가지고 저자는 뇌과학과 신경분야의 세계적인 석학들을 만나 지금까지의 연구동향과 전망을 듣고 특유의 치밀한 정보 수집력과 분석력을 발휘해 인간의 의식세계에 대한 집중 탐구를 시도한다."
9788934981763,"세포부터 생태계, 도시, 사회관계망과 기업까지 살아 있는 모든 것의 성장과 혁신, 노화와 죽음을 지배하는 패턴과 원리에 관한 흥미진진한 과학적 모험담 『스케일』. 복잡성 과학, 즉 창발적 시스템과 네트워크의 과학을 개척한 선구자로 널리 알려진 제프리 웨스트 교수와 샌타페이 연구진의 25년 연구를 종합하여 자연법칙과 인간 문명의 관계를 바라보는 새로운 시각, 새로운 개념 틀을 제시하는 책이다."
9791156330233,"상상만 해도 끔찍한 실험들이 과학이라는 이름 아래, 인류를 위한다는 명분 아래 우리 역사 속에서 실제로 벌어지고 있다. 과학과 의학은 우리들의 삶을 질병과 아픔에서 구해 줬다. 도저히 고칠 수 없다고 생각되던 병도 과학자들이 끈질긴 연구와 실험을 한 덕에 치료법과 약이 개발되었다. 그런데 과학은 정말 위험에 빠진 우리를 살린 슈퍼맨 같은 존재이기만 한 걸까? 『나쁜 과학자들』은 위대한 발견 뒤에 감춰져 있던 과학의 추하고 부끄러운 민낯을 낱낱이 공개함으로써 그에 대한 답을 해준다."
9788958203919,"가까이 하기 너무 먼 수학, 수학을 포기하고 놓아버리는 사람을 우리는 '수포자'라고 한다. 하지만 『길 위의 수학자』에서는 '일반인', '보통 씨(보통사람)'이라고 부른다. 이 책은 이 세상 모든 '보통 씨'를 위한 수학책이다. 지금으로부터 약 75년 전 1942년 처음 출간되어 지금까지 꾸준히 읽히고 있는 수학 분야 고전 필독서로 명쾌하고 강력한 수학적 사고와 대수학, 방정식, 삼각함수 등 현대 수학이 우리 일상생활에 어떻게 적용할 수 있는지 쉽고 재미있게 설명한다."
9791132102250,▶ 이 책은 현대물리학을 다룬 이론서입니다. 현대물리학의 기초적이고 전반적인 내용을 학습할 수 있습니다.
9791130627564,예일대학교 예일-뉴헤이븐병원의 신경과 상주의면서 질문에 기반한 철학에 학문적인 바탕을 두고 있는 엘리에저 스턴버그 박사의 세 번째 책이자 30세가 되기도 전에 출간된 『뇌가 지어낸 모든 세계』. 학문의 경계를 넘나드는 서술과 뇌과학의 방대한 연구 분야를 한 권에 담으려는 대담한 시도가 실현된 결과물이다. 
